<?xml version="1.0" encoding="UTF-8"?>
<!DOCTYPE Mancalaboard SYSTEM "MancalaDTD.dtd">
<Mancalaboard>
    <Spieler>
        <Name>Spieler1</Name>
        <AnzGewinne>5</AnzGewinne>
        <IstAmZug>Spieler1</IstAmZug>
        <AnzSteine>36</AnzSteine>
        <Spielfeld>
            <Kalaha>
                <AnzSteine>6</AnzSteine>
            </Kalaha>
            <Mulde>
                <AnzSteine>8</AnzSteine>
            </Mulde>
            <Mulde>
                <AnzSteine>5</AnzSteine>
            </Mulde>
            <Mulde>
                <AnzSteine>3</AnzSteine>
            </Mulde>
            <Mulde>
                <AnzSteine>2</AnzSteine>
            </Mulde>
            <Mulde>
                <AnzSteine>8</AnzSteine>
            </Mulde>
            <Mulde>
                <AnzSteine>4</AnzSteine>
            </Mulde>
        </Spielfeld>
    </Spieler>
    <Spieler>
        <Name>Spieler2</Name>
        <AnzGewinne>5</AnzGewinne>
        <IstAmZug>Spieler2</IstAmZug>
        <AnzSteine>36</AnzSteine>
        <Spielfeld>
            <Kalaha>
                <AnzSteine>7</AnzSteine>
            </Kalaha>
            <Mulde>
                <AnzSteine>8</AnzSteine>
            </Mulde>
            <Mulde>
                <AnzSteine>3</AnzSteine>
            </Mulde>
            <Mulde>
                <AnzSteine>6</AnzSteine>
            </Mulde>
            <Mulde>
                <AnzSteine>6</AnzSteine>
            </Mulde>
            <Mulde>
                <AnzSteine>6</AnzSteine>
            </Mulde>
            <Mulde>
                <AnzSteine>0</AnzSteine>
            </Mulde>
        </Spielfeld>
    </Spieler>
</Mancalaboard>